{
  "schema_version": "0.1",
  "case_id": "seeded-3-day-peanut-allergy",
  "decision": "block",
  "profile_summary": {
    "calorie_target_kcal": 2000,
    "protein_target_g": 98
  },
  "constraint_summary": {
    "days": 3,
    "meals_per_day": 3,
    "allergies": [
      "peanuts"
    ],
    "excluded_foods": [
      "shellfish"
    ],
    "max_sodium_mg_per_day": 2300,
    "max_added_sugar_g_per_meal": 10,
    "max_saturated_fat_pct_calories": 10,
    "calorie_tolerance_pct": 15,
    "requires_prep_safety_notes": true,
    "unresolved_policy": {}
  },
  "guideline_pack_id": "dga-2025-2030-us-adult-general-v1",
  "sections": [
    {
      "title": "Summary",
      "body": "The candidate plan has blocking issues and should be revised before use."
    },
    {
      "title": "Failed Or Warning Checks",
      "body": "6 checks require attention.",
      "items": [
        {
          "check_id": "quantities_resolvable",
          "message": "The candidate includes unresolved food quantities or units.",
          "severity": "block",
          "status": "block"
        },
        {
          "check_id": "allergens_absent",
          "message": "The candidate includes a declared allergen.",
          "severity": "block",
          "status": "block"
        },
        {
          "check_id": "calories_within_tolerance",
          "message": "One or more days are outside the configured calorie tolerance.",
          "severity": "warn",
          "status": "warn"
        },
        {
          "check_id": "sodium_under_limit",
          "message": "One or more days exceed the configured sodium limit.",
          "severity": "warn",
          "status": "warn"
        },
        {
          "check_id": "protein_minimum_met",
          "message": "One or more days are below the configured protein minimum.",
          "severity": "warn",
          "status": "warn"
        },
        {
          "check_id": "prep_safety_mentions_present",
          "message": "Prep notes do not mention prompt refrigeration or leftover handling.",
          "severity": "warn",
          "status": "warn"
        }
      ]
    },
    {
      "title": "Unresolved Foods",
      "body": "1 unresolved food or quantity items.",
      "items": [
        {
          "day": 2,
          "food": "seasoning blend",
          "meal": "lunch",
          "quantity": null,
          "quantity_text": "some",
          "unit": "",
          "unresolved_reason": "vague_quantity"
        }
      ]
    },
    {
      "title": "Excluded Unresolved Foods",
      "body": "0 de minimis unresolved items excluded from nutrition totals."
    },
    {
      "title": "Daily Totals",
      "body": "Calculated from the fixture nutrient catalog.",
      "items": [
        {
          "added_sugar_g": 0,
          "day": 1,
          "energy_kcal": 1741.315,
          "protein_g": 138.2596,
          "resolved_food_groups_present": {
            "dairy": true,
            "fats": true,
            "fruits": true,
            "protein": true,
            "vegetables": true,
            "whole_grains": true
          },
          "saturated_fat_pct_calories": 6.942391238805157,
          "sodium_mg": 2392.7940000000003
        },
        {
          "added_sugar_g": 0,
          "day": 2,
          "energy_kcal": 1274.9510000000002,
          "protein_g": 90.47120000000001,
          "resolved_food_groups_present": {
            "condiments": true,
            "fats": true,
            "fruits": true,
            "protein": true,
            "refined_grains": true,
            "vegetables": true,
            "whole_grains": true
          },
          "saturated_fat_pct_calories": 8.91761330435444,
          "sodium_mg": 5052.93
        },
        {
          "added_sugar_g": 0,
          "day": 3,
          "energy_kcal": 1430.241,
          "protein_g": 119.3142,
          "resolved_food_groups_present": {
            "dairy": true,
            "fats": true,
            "fruits": true,
            "protein": true,
            "vegetables": true,
            "whole_grains": true
          },
          "saturated_fat_pct_calories": 4.189517710651563,
          "sodium_mg": 3077.3
        }
      ]
    }
  ],
  "disclaimer": "MealCheck checks bounded guideline-derived rules. It does not provide medical nutrition advice."
}
